S.no,Name of the report,Year,Released Month,Link,Tags,AID,SID,SSID,CDN Report Link,Thumbnail Links- New,,
1,Future Of Play: Building The Next-Gen of Gaming,2023,October,https://drive.google.com/file/d/16TsgnXcccOBC5K9_mWclj3XBgYKlM-Kp/view?usp=sharing,"games, game industry, digital gaming, interactive entertainment, game tech ",1011,5000,5001,https://vc-thumbnails.blr1.cdn.digitaloceanspaces.com/Reports/Elevation/Future%20of%20Play.pdf,https://vc-thumbnails.blr1.cdn.digitaloceanspaces.com/thumbnails/1.webp,,
2,Mapping A Billion: Understanding The Indian Fintech User,2023,Nov,https://drive.google.com/file/d/1AvMCH4aOMnKpihmH8IaWKtxGONRVwVB_/view?usp=sharing,"financial tech, financial services, digital banking, fintech consumers, fintech trends ",1011,9000,9001,https://vc-thumbnails.blr1.cdn.digitaloceanspaces.com/Reports/Elevation/Mapping%20A%20Billion.pdf,https://vc-thumbnails.blr1.cdn.digitaloceanspaces.com/thumbnails/2.webp,,
3,Marketplaces Unleashed: Fuelling India’s $200B Consumer Spending Surge,2023,Sept,https://drive.google.com/file/d/1c2w5gVd67T8UmkU8X8uoASZwxEL86D2U/view?usp=sharing,"online marketplaces, consumer market, digital commerce, retail growth, spending trends ",1011,5000,5002,https://vc-thumbnails.blr1.cdn.digitaloceanspaces.com/Reports/Elevation/Marketplaces%20Unleashed%20Consolidated%20Presentation.pdf,https://vc-thumbnails.blr1.cdn.digitaloceanspaces.com/thumbnails/3.webp,,
4,The Bottomline: Elevation Fintech Report 2023,2023,Aug,https://drive.google.com/file/d/14m9Re8bSJxAc9x83Do2kbwz-Vc9kgfPC/view?usp=sharing,"financial services, digital finance, fintech analysis, fintech trends, finance insights ",1011,9000,9001,https://vc-thumbnails.blr1.cdn.digitaloceanspaces.com/Reports/Elevation/The%20Bottomline-%20Elevation%20Fintech%20Report.pdf,https://vc-thumbnails.blr1.cdn.digitaloceanspaces.com/thumbnails/4.webp,,
5,Startup Paypulse Report 2023,2023,Aug,https://drive.google.com/file/d/1rO9N6pcuyp7YLpqitnNDFQdA73d5iM3C/view?usp=sharing,"new businesses, startup ecosystem, fintech startups, payment trends, startup growth ",1011,12000,12001,https://vc-thumbnails.blr1.cdn.digitaloceanspaces.com/Reports/Elevation/Elevation%20Startup%20PayPulse%20Report%202023.pdf,https://vc-thumbnails.blr1.cdn.digitaloceanspaces.com/thumbnails/5.webp,,
6,India Pulse: 2022,2022,Dec,https://drive.google.com/file/d/1QEfkMlcdEWRLK2MmOeY53aVWv8WXGC0q/view?usp=sharing,"India analysis, economic pulse, market trends, industry insights","1011, 1025",22000,22001,https://vc-thumbnails.blr1.cdn.digitaloceanspaces.com/Reports/Elevation/India%20Pulse%202022%20_%20Elevation%20&%20Tracxn.pdf,https://vc-thumbnails.blr1.cdn.digitaloceanspaces.com/thumbnails/6.webp,,
7,Battery Bluprint Innovation & Investment Outlook,2023,Aug,https://drive.google.com/file/d/1M6JrAGERLVtrss8MTLl-nw336wyvXNcI/view?usp=sharing,"battery innovation, investment trends, energy storage, tech outlook ",1012,8000,8001,https://vc-thumbnails.blr1.cdn.digitaloceanspaces.com/Reports/BlumeVentures/Battery-tech-BLUprint-v2.pdf,https://vc-thumbnails.blr1.cdn.digitaloceanspaces.com/thumbnails/7.webp,,
8,Blue Collar Workforce: Thesis By Blume Ventures,2021,Apr,https://drive.google.com/file/d/1SKehixIV-GozLmNnzhTIWsQ4YGk8fNMT/view?usp=sharing,"labor force, industrial workers, job market, workforce trends, labor analysis ",1012,7000,7001,https://vc-thumbnails.blr1.cdn.digitaloceanspaces.com/Reports/BlumeVentures/Blue%20Collar%20Thesis%20by%20Blume.pdf,https://vc-thumbnails.blr1.cdn.digitaloceanspaces.com/thumbnails/8.webp,,
9,Indian Edtech In 2022: Building In The Shadow of Giants,2022,Dec,https://drive.google.com/file/d/1xeXWSCPFV7Q9aZWbNsJGYc4arKKxEvRh/view?usp=sharing,"e-learning, digital education, education startups, tech in education, education sector, edtech, ed-tech",1012,5000,5003,https://vc-thumbnails.blr1.cdn.digitaloceanspaces.com/Reports/BlumeVentures/Blume%20Edtech%20Report%202022.pdf,https://vc-thumbnails.blr1.cdn.digitaloceanspaces.com/thumbnails/9.webp,,
10,Demystifying The Indian EV Ecosystem,2023,June,https://drive.google.com/file/d/1LzbZ-A5Fn0iYdK7R-ZfgnmTtbcMTt6Mh/view?usp=sharing,"electric cars, EV industry, sustainable transport, green vehicles, EV trends ",1012,8000,8002,https://vc-thumbnails.blr1.cdn.digitaloceanspaces.com/Reports/BlumeVentures/Blume%20EV%20Primer%202.0%20%5BJune%202023%5D.pdf,https://vc-thumbnails.blr1.cdn.digitaloceanspaces.com/thumbnails/10.webp,,
11,Hacking The Cybersecurity Market,2020,October,https://drive.google.com/file/d/1QuDQY0w6KcMiwJpf-1vi6uFHkMJ0rdBK/view?usp=sharing,"cyber defense, information security, security tech, cybersecurity trends, digital protection ",1012,20000,20001,https://vc-thumbnails.blr1.cdn.digitaloceanspaces.com/Reports/BlumeVentures/Cybersecurity%20Thesis%20Final%20-%20External.pptx.pdf,https://vc-thumbnails.blr1.cdn.digitaloceanspaces.com/thumbnails/11.webp,,
12,Developer-Led landscape,2022,Sept,https://drive.google.com/file/d/15mhvnKqiaWriFO02QnTs4EBxcikDSK8X/view?usp=sharing,"software engineers, developer trends, tech development, IT landscape, coding industry ",1012,15000,15001,https://vc-thumbnails.blr1.cdn.digitaloceanspaces.com/Reports/BlumeVentures/Dev%20Market%20Report.pdf,https://vc-thumbnails.blr1.cdn.digitaloceanspaces.com/thumbnails/12.webp,,
13,Future Of HR tech: From India For The World,2023,Aug,https://drive.google.com/file/d/1Oa47jaoWvUslXvcxsplDZHqhZOinqApo/view?usp=sharing,"human capital management, HR innovation, workforce tech, employee management, HR trends, hr-tech, hrtech",1012,20000,20002,https://vc-thumbnails.blr1.cdn.digitaloceanspaces.com/Reports/BlumeVentures/HRTech-Thesis-Presentation.f1693292706.pdf,https://vc-thumbnails.blr1.cdn.digitaloceanspaces.com/thumbnails/13.webp,,
14,Indus Valley Annual Report 2022,2022,April,https://drive.google.com/file/d/1LiN-Mj0MIJcmLZW4xwY2Jrv9Jz7lR1Zo/view?usp=sharing,"yearly report, business review, market trends, industry report, 2022 summary ",1012,5000,5004,https://vc-thumbnails.blr1.cdn.digitaloceanspaces.com/Reports/BlumeVentures/Indus%20Valley%20Annual%20Report%202022.pdf,https://vc-thumbnails.blr1.cdn.digitaloceanspaces.com/thumbnails/14.webp,,
15,Indus Valley Annual Report 2023,2023,April,https://drive.google.com/file/d/1WxSJsd-OMHgfWeo-rq-Qnan-MyXPuRXR/view?usp=sharing,"yearly report, business review, market trends, industry report, 2023 summary ",1012,5000,5004,https://vc-thumbnails.blr1.cdn.digitaloceanspaces.com/Reports/BlumeVentures/Indus%20Valley%20Annual%20Report%202023.pdf,https://vc-thumbnails.blr1.cdn.digitaloceanspaces.com/thumbnails/15.webp,,
16,Mental Healthcare Thesis By Blume Ventures,2022,October,https://drive.google.com/file/d/1da15LpKQM2I3sbG4afg6QP6WyccuWI8l/view?usp=sharing,"psychological care, mental wellness, health startups, healthcare trends, mental health industry ",1012,10000,10001,https://vc-thumbnails.blr1.cdn.digitaloceanspaces.com/Reports/BlumeVentures/Mental%20Healthcare%20Report%20Blume.pdf,https://vc-thumbnails.blr1.cdn.digitaloceanspaces.com/thumbnails/16.webp,,
17,The Omega Files: Look Into Blume's Fund I Returns,2023,Dec,https://drive.google.com/file/d/1RdMEaOlRdKpRfjltOANOd9Xo2gZEd8X8/view?usp=sharing,"VC returns, fund performance, investment insights, Blume analysis, financial returns ",1012,22000,22002,https://vc-thumbnails.blr1.cdn.digitaloceanspaces.com/Reports/BlumeVentures/The%20Omega%20Files_%20Episode%201.pdf,https://vc-thumbnails.blr1.cdn.digitaloceanspaces.com/thumbnails/17.webp,,
18,Beauty Unveiled : Decoding The Success of Pure-Play Beauty Companies,2023,Sept,https://drive.google.com/file/d/1SY_ker2EZ1mf0EhZBovLa8C9HmREmrUm/view?usp=sharing,"beauty industry, pure-play beauty, success factors, market analysis, cosmetic brands, beauty market insights, beauty trends, skincare companies","1003, 1020",5000,5005,https://vc-thumbnails.blr1.cdn.digitaloceanspaces.com/Reports/Redseer/RedSeer_BPC%20Report_.pdf,https://vc-thumbnails.blr1.cdn.digitaloceanspaces.com/thumbnails/18.webp,,
19,AgriTech: India’s Sunrise Sector,2023,Sept,https://drive.google.com/file/d/1THFSznxwIxhF8VtBVkxU_5pCBfAqzE6y/view?usp=sharing,"agri innovation, farm tech, agricultural trends, agribusiness, tech in agriculture , agri-tech, agritech",1013,2000,2001,https://vc-thumbnails.blr1.cdn.digitaloceanspaces.com/Reports/Kaalari/AgriTech-Indias-Sunrise-Sector.pdf,https://vc-thumbnails.blr1.cdn.digitaloceanspaces.com/thumbnails/19.webp,,
20,India Venture Capital Report 2021 (Covering 2020 Only),2021,March,https://drive.google.com/file/d/1NYhcQgPAX7gE8fHZYjLvXOZv4tUqjK40/view?usp=sharing,"VC report, investment review, funding analysis, 2020 venture, capital trends ",1001,22000,22001,https://vc-thumbnails.blr1.cdn.digitaloceanspaces.com/Reports/Bain&Company/bain_report_india_venture_capital_2021_compressed.pdf,https://vc-thumbnails.blr1.cdn.digitaloceanspaces.com/thumbnails/20.webp,,
21,India Venture Capital Report 2022 (Covering 2021 Only),2022,March,https://drive.google.com/file/d/11A3Faeecp9mbU0cnCAGMEhm9jo8iAwPC/view?usp=sharing,"VC report, investment review, funding analysis, 2021 venture, capital trends ",1001,22000,22001,https://vc-thumbnails.blr1.cdn.digitaloceanspaces.com/Reports/Bain&Company/Bain-India-VC-2022.pdf,https://vc-thumbnails.blr1.cdn.digitaloceanspaces.com/thumbnails/21.webp,,
22,"Beyond E-Commerce 3.0 : D2C, Ecom Enablement & ONDC",2023,Jan,https://drive.google.com/file/d/1sKo7U1yhV5HOscr9I5D_x_r5y043b2lm/view?usp=sharing,"e-commerce, D2C, ecom enablement, ONDC, digital commerce,  online shopping, direct-to-consumer, ecom tools, digital marketplaces, ecommerce, ecom",1013,5000,5006,https://vc-thumbnails.blr1.cdn.digitaloceanspaces.com/Reports/Kaalari/Beyond-E-Commerce-3.0-1.pdf,https://vc-thumbnails.blr1.cdn.digitaloceanspaces.com/thumbnails/22.webp,,
23,Chronic Care : Solving For The Pervasive Chronic Disease Scourge In India,2021,Sept,https://drive.google.com/file/d/1YAnYJtFaFazom9OHsF3IcCHy6apg6ZlW/view?usp=sharing,"chronic disease, healthcare, disease management, India health, healthcare solutions, chronic condition, medical care, health challenges",1013,10000,10002,https://vc-thumbnails.blr1.cdn.digitaloceanspaces.com/Reports/Kaalari/chronic-care_compressed.pdf,https://vc-thumbnails.blr1.cdn.digitaloceanspaces.com/thumbnails/23.webp,,
24,Circular Economy,2022,May,https://drive.google.com/file/d/1hqZxIXMKMQhqMPTQPfbE1Mv_Sn4_svV7/view?usp=sharing,"sustainable economy, waste recycling, eco economy, green business, circular model ",1013,4000,4001,https://vc-thumbnails.blr1.cdn.digitaloceanspaces.com/Reports/Kaalari/Circular-Economy-Report-2022.pdf,https://vc-thumbnails.blr1.cdn.digitaloceanspaces.com/thumbnails/24.webp,,
25,Creator Economy,2022,Jan,https://drive.google.com/file/d/1-_tGNcKQHojZ3BnNCdeD7kiewciwofdS/view?usp=sharing,"content creation, digital influencers, creator market, social media creators, creator trends ",1013,6000,6001,https://vc-thumbnails.blr1.cdn.digitaloceanspaces.com/Reports/Kaalari/Creator-Economy-Kalaari-Capital.pdf,https://vc-thumbnails.blr1.cdn.digitaloceanspaces.com/thumbnails/25.webp,,
26,"Decode Your

Termsheet",2023,Nov,https://drive.google.com/file/d/1S6fq32V-YiF2YR8-s61Gw5AKPzDtEI2F/view?usp=sharing,"termsheet, investment, finance, business, decoding investment agreement, financial terms, business contract, deciphering terms",1013,22000,22003,https://vc-thumbnails.blr1.cdn.digitaloceanspaces.com/Reports/Kaalari/Decode-Your-Termsheet-%20Kalaari.pdf,https://vc-thumbnails.blr1.cdn.digitaloceanspaces.com/thumbnails/26.webp,,
27,Decoding Digital India,2024,Jan,https://drive.google.com/file/d/1-hNcp1cKLL2v8NoOaBUhefWUszyLnwbU/view?usp=sharing,"digital growth, tech in India, digital economy, technology trends, Indian tech, DPI",1013,5000,5004,https://vc-thumbnails.blr1.cdn.digitaloceanspaces.com/Reports/Kaalari/Decoding-Digital-India%20Kalaari.pdf,https://vc-thumbnails.blr1.cdn.digitaloceanspaces.com/thumbnails/27.webp,,
28,Experience Economy,2022,Jan,https://drive.google.com/file/d/1g8hqYebfFfc_7QzabHNJivBcZBKsuB04/view?usp=sharing,"experiential economy, customer engagement, service trends, experience market, consumer experience, entertainment, experience",1013,5000,5004,https://vc-thumbnails.blr1.cdn.digitaloceanspaces.com/Reports/Kaalari/Experience-Economy_Final.pdf,https://vc-thumbnails.blr1.cdn.digitaloceanspaces.com/thumbnails/28.webp,,
29,State of Women In Tech Entrepreneurship 2020 In India,2020,Nov,https://drive.google.com/file/d/18nWCE7u5Vc1vlmv5IIzgqP41TcuS0-2i/view?usp=sharing,"female entrepreneurs, tech industry, women founders, startup ecosystem, 2020 trends ",1010,22000,22001,https://vc-thumbnails.blr1.cdn.digitaloceanspaces.com/Reports/Yourstory/Finalversion-MakersWomeninTechReport-1613978390144.pdf,https://vc-thumbnails.blr1.cdn.digitaloceanspaces.com/thumbnails/29.webp,,
30,Gameconomy: Primer On India's Gaming Opportunity,2023,Jan,https://drive.google.com/file/d/1GzQGdpFmIVwmMRkVbRL1vThh_L5t_eWr/view?usp=sharing,"gaming industry, game market trends, video games, gaming insights, India games, game",1013,5000,5001,https://vc-thumbnails.blr1.cdn.digitaloceanspaces.com/Reports/Kaalari/Gameconomy-by-Kalaari-Jan-2023.pdf,https://vc-thumbnails.blr1.cdn.digitaloceanspaces.com/thumbnails/30.webp,,
31,Hindustan Hamara : A look into the Indian opportunity,2021,Dec,https://drive.google.com/file/d/13hgkIK0wzt2GY7ZUPZdDxLuxyhtg5jK9/view?usp=sharing,"India market, Indian economy, opportunity analysis, market trends,  Indian business, economic outlook, market insights, growth prospects",1013,5000,5004,https://vc-thumbnails.blr1.cdn.digitaloceanspaces.com/Reports/Kaalari/Hindustan-Hamara-Kalaari-Capital-2021.pdf,https://vc-thumbnails.blr1.cdn.digitaloceanspaces.com/thumbnails/31.webp,,
32,India SaaS: Founder Playbook,2023,Feb,https://drive.google.com/file/d/1Nqxkal6aioutzIRpoDdTEPIRSIN79OgS/view?usp=sharing,"SaaS companies, software services, founder guide, tech startups, SaaS trends ",1013,20000,20003,https://vc-thumbnails.blr1.cdn.digitaloceanspaces.com/Reports/Kaalari/Kalaari-SaaS-%E2%80%93-Founder-Playbook-1.pdf,https://vc-thumbnails.blr1.cdn.digitaloceanspaces.com/thumbnails/32.webp,,
33,ONDC: Frictionless Digital Commerce,2023,Nov,https://drive.google.com/file/d/10Tp-5KXdHmu9jT42rlB6nd0ZJ7HJ4KZ9/view?usp=sharing,"digital marketplaces, e-commerce platforms, seamless commerce, online retail, ONDC trends, ecommerce, ecom",1013,5000,5006,https://vc-thumbnails.blr1.cdn.digitaloceanspaces.com/Reports/Kaalari/ONDC-Primer-%E2%80%93-Kalaari.pdf,https://vc-thumbnails.blr1.cdn.digitaloceanspaces.com/thumbnails/33.webp,,
34,ONDC Seller Side: Frictionless Digital Commerce,2023,Aug,https://drive.google.com/file/d/1vI-ZQQTSV14rBV9LEue8kvWyUZtbIK8g/view?usp=sharing,"digital marketplaces, e-commerce platforms, seamless commerce, online retail, ONDC sellers , ecommerce, ecom",1013,5000,5006,https://vc-thumbnails.blr1.cdn.digitaloceanspaces.com/Reports/Kaalari/ONDC-Primer-%E2%80%93-Part-1-Final.pdf,https://vc-thumbnails.blr1.cdn.digitaloceanspaces.com/thumbnails/34.webp,,
35,State of Women In Tech Entrepreneurship 2020 In India,2023,March,https://drive.google.com/file/d/1TznzyntSVm5A0BpQ2YWhxLBOwl7FPBw0/view?usp=sharing,"female entrepreneurs, tech industry, women founders, startup ecosystem, 2020 trends ","1013, 1010",22000,22001,https://vc-thumbnails.blr1.cdn.digitaloceanspaces.com/Reports/Kaalari/State-of-Women-Entrepreneurship_CXXO_Kalaari.pdf,https://vc-thumbnails.blr1.cdn.digitaloceanspaces.com/thumbnails/35.webp,,
36,Uniquely India: Digital Opportunity,2021,Aug,https://drive.google.com/file/d/1tJVB76k8VX_Oebsgz-HEjiTDsMOlatDb/view?usp=sharing,"digital growth, tech in India, digital economy, unique trends, Indian tech ",1013,5000,5004,https://vc-thumbnails.blr1.cdn.digitaloceanspaces.com/Reports/Kaalari/uniquely-india.pdf,https://vc-thumbnails.blr1.cdn.digitaloceanspaces.com/thumbnails/36.webp,,
37,State of The Fintech Union 2022,2022,Aug,https://drive.google.com/file/d/1obdGzs-yI-R22Yjo89hTEmSfBnfL0w1W/view?usp=sharing,"financial services, digital banking, fintech analysis, financial trends, 2022 insights ","1004, 1018",9000,9001,https://vc-thumbnails.blr1.cdn.digitaloceanspaces.com/Reports/Matrix/state-of-india-fintech-union-2022.pdf,https://vc-thumbnails.blr1.cdn.digitaloceanspaces.com/thumbnails/37.webp,,
38,State of The Fintech Union 2023,2023,Sept,https://drive.google.com/file/d/1EeMDnJoMYtixqlFdCsvkPscGBsJItYZQ/view?usp=sharing,"financial services, digital banking, fintech analysis, financial trends, 2023 insights ","1004, 1018",9000,9001,https://vc-thumbnails.blr1.cdn.digitaloceanspaces.com/Reports/Matrix/state-of-the-fintech-union-2023.pdf,https://vc-thumbnails.blr1.cdn.digitaloceanspaces.com/thumbnails/38.webp,,
39,Cracking The Code : Unveiling India's Consumer Landscape,2023,Dec,https://drive.google.com/file/d/1GnXwmOd2qnDHO-hGIjQaNb433XIpwPOO/view?usp=sharing,"consumer behavior, market analysis, India market, consumer trends,  consumer insights, market research, retail landscape, consumer preferences","1006, 1019",5000,5001,https://vc-thumbnails.blr1.cdn.digitaloceanspaces.com/Reports/Chiratae%20Consumer%20Tech%20Report.pdf,https://vc-thumbnails.blr1.cdn.digitaloceanspaces.com/thumbnails/39.webp,,
40,The Rise Of Digital Bazaars In India,2022,Dec,https://drive.google.com/file/d/1ZmJq5RJbsXKrAVr6sCjCYDKnnjr1e0eL/view?usp=sharing,"e-commerce platforms, online retail, digital trade, marketplace trends, India digital, ecommerce",1001,5000,5006,https://vc-thumbnails.blr1.cdn.digitaloceanspaces.com/Reports/Bain&Company/Digital%20Bazaar_Accel.pdf,https://vc-thumbnails.blr1.cdn.digitaloceanspaces.com/thumbnails/40.webp,,
41,The Winds Of Change: Trends Shaping India’s Fintech Sector- Edition II,2022,Sept,https://drive.google.com/file/d/1ey4VS_vu606nTRlaUlizMTFdZl5igyet/view?usp=sharing,"financial services, digital banking, fintech growth, market insights, financial trends",1002,9000,9001,https://vc-thumbnails.blr1.cdn.digitaloceanspaces.com/Reports/ey-winds-of-change-india-fintech-report-2022.pdf,https://vc-thumbnails.blr1.cdn.digitaloceanspaces.com/thumbnails/41.webp,,
42,E-Conomy India 2023,2023,June,https://drive.google.com/file/d/13jyhhDeGB3RedW4ptARiMtM33LRBtkq1/view?usp=sharing,"digital growth, tech economy, economic trends, digital market, India 2023 , digital economy, ecommerce, ecom","1001, 1017, 1022",5000,5004,https://vc-thumbnails.blr1.cdn.digitaloceanspaces.com/Reports/india_economy_report_2023.pdf,https://vc-thumbnails.blr1.cdn.digitaloceanspaces.com/thumbnails/42.webp,,
43,Delivery Delight Index,2021,June,https://drive.google.com/file/d/1WPlQG9nAcQANERAfUT0W6GYc_2z25Fu7/view?usp=sharing,"delivery performance, logistics trends, customer delivery, e-commerce logistics, satisfaction index, delhivery",1003,5000,5006,https://vc-thumbnails.blr1.cdn.digitaloceanspaces.com/Reports/Redseer/Delivery%20delight%20index%208.pdf,https://vc-thumbnails.blr1.cdn.digitaloceanspaces.com/thumbnails/43.webp,,
44,"Beauty D2C Perspective- Is direct the way to go for
Beauty?",2022,Nov,https://drive.google.com/file/d/1U8KDbrdiNxcZ-5tD46q9lCU_LQQUHH1y/view?usp=sharing,"beauty industry, D2C brands, direct-to-consumer, market perspective, beauty ecommerce, D2C strategy, cosmetic brands, consumer direct",1003,5000,5006,https://vc-thumbnails.blr1.cdn.digitaloceanspaces.com/Reports/Redseer/RSC-Beauty-D2C-Perspective-vF.pdf,https://vc-thumbnails.blr1.cdn.digitaloceanspaces.com/thumbnails/44.webp,,
45,"Restaurants D2C Perspective- How can restaurants sustain in
the evolving food service
industry?",2022,Nov,https://drive.google.com/file/d/12OCuRfdDTPCiHk6Z6jnsC-LNWyPjJblB/view?usp=sharing,"restaurant industry, food service, D2C strategy, market perspective, restaurant survival, food delivery, digital transformation, dining trends",1003,5000,5007,https://vc-thumbnails.blr1.cdn.digitaloceanspaces.com/Reports/Redseer/RSC-Restaurant-D2C-perspective-vf-1.pdf,https://vc-thumbnails.blr1.cdn.digitaloceanspaces.com/thumbnails/45.webp,,
46,Online Higher Education & Lifelong Learning: A $5B Opportunity,2020,Aug,https://drive.google.com/file/d/1db1duS-VLKPHWDZbZ8Awbu26en-GX_TH/view?usp=sharing,"digital learning, education trends, e-learning growth, education market, online courses ",1003,5000,5003,https://vc-thumbnails.blr1.cdn.digitaloceanspaces.com/Reports/Redseer/%20Summary%20highered%20market%20narrative%20redseer%20report.pdf,https://vc-thumbnails.blr1.cdn.digitaloceanspaces.com/thumbnails/46.webp,,
47,Neobanking In India: The Matrix Upgraded,2022,April,https://drive.google.com/file/d/1yz4dduu_e3UT680t1-VFKuAtuKXS1yr6/view?usp=sharing,"online banking, digital finance, fintech trends, banking innovation, neobank trends ",1003,9000,9001,https://vc-thumbnails.blr1.cdn.digitaloceanspaces.com/Reports/Redseer/Redseer%20neobanking%20report%20final%20versionv3.pdf,https://vc-thumbnails.blr1.cdn.digitaloceanspaces.com/thumbnails/47.webp,,
48,The Future of Online Payments 2023,2023,June,https://drive.google.com/file/d/1KD0dxXnHFdfU9FhiG8j26J4taj6wf_N8/view?usp=sharing,"e-payments, payment technology, digital finance, financial transactions, payment insights ",1003,9000,9001,https://vc-thumbnails.blr1.cdn.digitaloceanspaces.com/Reports/Redseer/The%20future%20of%20online%20payments.pdf,https://vc-thumbnails.blr1.cdn.digitaloceanspaces.com/thumbnails/48.webp,,
49,Online Grocery: What Brands Need To Know?,2020,Sept,https://drive.google.com/file/d/1wJc12hEGVBXSbzMbtQPpfLNR4_xhpMsQ/view?usp=sharing,"grocery e-commerce, online shopping, retail trends, digital groceries, market analysis, ecommerce, grocery ecommerce, bigbasket","1003, 1024",5000,5006,https://vc-thumbnails.blr1.cdn.digitaloceanspaces.com/Reports/Redseer/Smart-Clicks-To-Win-Indias-Online-Groceries-_-General-Merchandise-Basket-1.pdf,https://vc-thumbnails.blr1.cdn.digitaloceanspaces.com/thumbnails/49.webp,,
50,India Agritech Perspective Vol - 1,2022,Sept,https://drive.google.com/file/d/1SzDAZNCHJo-mqzYrfCF2-IYVLvKYJdVv/view?usp=sharing,"agri tech trends, farm tech, agriculture insights, agribusiness, tech in farming, agri-tech",1003,2000,2001,https://vc-thumbnails.blr1.cdn.digitaloceanspaces.com/Reports/Redseer/Agritech-Report-Ver-2LQ.pdf,https://vc-thumbnails.blr1.cdn.digitaloceanspaces.com/thumbnails/50.webp,,
51,The Dire Need And Rise of Digital Chronic Disease Management In India,2022,June,https://drive.google.com/file/d/1UBhMt8E8rmzm2S5bxZzc0l8p9WgnGIGL/view?usp=sharing,"digital health, chronic care, medical management, health trends, disease management ",1003,10000,10002,https://vc-thumbnails.blr1.cdn.digitaloceanspaces.com/Reports/Redseer/The%20Dire%20Need%20and%20Rise%20of%20Digital.pdf,https://vc-thumbnails.blr1.cdn.digitaloceanspaces.com/thumbnails/51.webp,,
52,Logistics Needs of Indian D2C,2023,Sept,https://drive.google.com/file/d/1v0tMc4CksJWCcRtkjT_NSAGf2g8fseT0/view?usp=sharing,"e-commerce logistics, supply chain management, delivery trends, direct-to-consumer logistics, logistics solutions, delivery, delhivery",1003,5000,5006,https://vc-thumbnails.blr1.cdn.digitaloceanspaces.com/Reports/Redseer/D2C-logistics-report_10-10-23_v4.pdf,https://vc-thumbnails.blr1.cdn.digitaloceanspaces.com/thumbnails/52.webp,,https://vc-thumbnails.blr1.cdn.digitaloceanspaces.com/Reports/Redseer/State%20of%20E-logistics%20in%20India.pdf
53,Creator Marketplace: Bridging Gap Between Brands and Influencers in a Ballooning Digital Ad Market- Digital Advertising In India And Disruptive Trends,2023,Jan,https://drive.google.com/file/d/1SesqnpEJy8to4uRceOuS7E1CDREoLE0m/view?usp=sharing,"influencer marketing, digital ads, advertising trends, brand collaboration, market insights ",1003,19000,19001,https://vc-thumbnails.blr1.cdn.digitaloceanspaces.com/Reports/Redseer/Digital-Ad-and-creator-marketplace_vF-1.pdf,https://vc-thumbnails.blr1.cdn.digitaloceanspaces.com/thumbnails/53.webp,,
54,Demystifing Kirana Ecommerce In India: eE2B Report,2022,Sept,https://drive.google.com/file/d/1DxsXYcn6lmDEjaGzsidmPJ46MoNvNcK_/view?usp=sharing,"Kirana ecommerce, Indian retail, e-commerce, market analysis,  local retail, small shop ecommerce, digital retail, Kirana trends, mom and pop",1003,5000,5008,https://vc-thumbnails.blr1.cdn.digitaloceanspaces.com/Reports/Redseer/eB2B-report.pdf,https://vc-thumbnails.blr1.cdn.digitaloceanspaces.com/thumbnails/54.webp,,https://vc-thumbnails.blr1.cdn.digitaloceanspaces.com/Reports/Redseer/Redseer-Report-Demystifying-Indias-SFV-Platforms-08112384.pdf
55,Edtech In India 2019-20,2020,May,https://drive.google.com/file/d/1vye5qBUrdGVGaONQ64wkvR-TOHTLwCU0/view?usp=sharing,"e-learning, digital education, education startups, tech in education, education sector, ed-tech",1003,5000,5003,https://vc-thumbnails.blr1.cdn.digitaloceanspaces.com/Reports/Redseer/EdTech-in-India_An-Omidyar-Network-India-%E2%80%93-RedSeer-Perspective.pdf,https://vc-thumbnails.blr1.cdn.digitaloceanspaces.com/thumbnails/55.webp,,
56,Entertainment & Advertising : Riding The Digital Wave,2021,July,https://drive.google.com/file/d/1mS4h1irCjuELfZhR8qR0VUWpLiXiMb8n/view?usp=sharing,"digital media, ad trends, entertainment industry, digital advertising, market insights, adtech, ad-tech",1003,19000,19002,https://vc-thumbnails.blr1.cdn.digitaloceanspaces.com/Reports/Redseer/entertainmentandadvertisingridingthedigitalwave-210729133233-1.pdf,https://vc-thumbnails.blr1.cdn.digitaloceanspaces.com/thumbnails/56.webp,,
57,Gated Community: $500B Consumption Story In 2026,2021,Nov,https://drive.google.com/file/d/1hQWIh8RBOJtEkl_fmh_v3GyXgBOtFiKI/view?usp=sharing,"community consumption, market forecast, economic trends, future insights, consumer market, mygate, nobroker, societies, apartments",1003,5000,5004,https://vc-thumbnails.blr1.cdn.digitaloceanspaces.com/Reports/Redseer/gatecommunity-211110065843.pdf,https://vc-thumbnails.blr1.cdn.digitaloceanspaces.com/thumbnails/57.webp,,
